{
    "TemplateID": "default_male",
    "NameFirst": "Pierre",
    "NameLast": "Schwarz",
    "TexturePath": {
        "Value": "npc/school/students/pierrePortrait.png"
    },
    "Schedules":{
        "dahlem/school/dorm.3_314": {
            "0": {
                "TimeStart": 1000,
                "TimeEnd": 2359
            }
        }
    }
}